{
  "object_id": "f6bcb55e-0bf8-419b-b4da-8d09ff8fc167",
  "object_type": "fabrication_simulation",
  "origin_domain": "sim_fabrication",
  "created_at_utc": "2026-10-01T04:10:27Z",
  "schema_version": "1.0",
  "content_hash_sha256": "5667873ca41968bea3e41b68dbc03321a22e8553059271ec65b522a0657e7b26",
  "content_size_bytes": 62883,
  "local_storage_reference": "sim://fabrication/factory-world-v1",
  "ipfs_cid": "",
  "pcloud_archive_reference": "",
  "transaction_id": null,
  "authorization_policy_id": "",
  "producer_key_id": "ao-sim-fabrication",
  "signature": ""
}
